<?xml version="1.0" encoding="UTF-8"?>

<!--
    Document   : calendar-schema1.11.xml
    Created on : 28. duben 2011, 19:43
    Author     : AdiC
    Description:
        Purpose of the document follows.
-->

<calendar xmlns:xsi='http://www.w3.org/2001/XMLSchema-instance' xsi:noNamespaceSchemaLocation='calendar-schemaa.xsd' >
    <labels>
        <tag>blue</tag>
        
    </labels>
    <event id="1">
        <since>12:12:12</since>
        <duration>PT1H</duration>
        <date>2011-04-14</date>
        <title>a</title>
        <place></place>
        <note></note>
        <tags>
            <tag>blue</tag>
        </tags>
    </event>
    <event id="2">
        <since>12:12:12</since>
        <duration>PT1H</duration>
        <date>2011-03-11</date>
        <title>b</title>
        <place></place>
        <note></note>
         <tags>
            <tag>white</tag>
        </tags>
    </event>

</calendar>
